{
  "$schema": "http://json-schema.org/draft-07/schema#",
  "title": "AvanyxSecondBrainMemory",
  "type": "object",
  "required": ["id", "tenantId", "content", "tier", "classification", "authority", "confidence", "createdAt"],
  "properties": {
    "id": { "type": "string" },
    "tenantId": { "type": "string" },
    "userId": { "type": ["string", "null"] },
    "tier": { "type": "string", "enum": ["permanent", "contextual", "temporary", "user"] },
    "classification": { "type": "string", "enum": ["temporary", "context", "memory", "knowledge", "decision", "insight"] },
    "content": { "type": "string" },
    "summary": { "type": "string" },
    "tags": { "type": "array", "items": { "type": "string" } },
    "entities": { "type": "array", "items": { "type": "string" } },
    "concepts": { "type": "array", "items": { "type": "string" } },
    "authority": { "type": "string", "enum": ["PRIMARY", "SECONDARY", "USER_PROVIDED", "SYSTEM_GENERATED", "INFERRED"] },
    "confidence": { "type": "number", "minimum": 0, "maximum": 1 },
    "status": { "type": "string", "enum": ["active", "archived", "stale", "deprecated"] },
    "source": { "type": "string" },
    "provenance": { "type": "string" },
    "expiresAt": { "type": ["string", "null"] },
    "createdAt": { "type": "string" },
    "updatedAt": { "type": "string" },
    "metadata": { "type": "object" }
  }
}
